,CreateDate,url,NewsTitle,NewsNotes
0,2018-08-16T09:32:41,/news/100011705.html,商务部副部长王受文将应邀率团赴美举行中美经贸问题副部级磋商,中方重申，反对单边主义和贸易保护主义做法，不接受任何单边贸易限制措施。中方欢迎在对等、平等、诚信的基础上，开展对话和沟通。
1,2018-08-16T08:34:44,/news/100011666.html,机器人产业规模持续增长，细分领域长期受益,2018世界机器人大会在北京亦创国际会展中心开幕
2,2018-08-16T08:34:09,/news/100011664.html,政策推动软件业发展，云计算大数据产业景气向好,"下一步工业和信息化部将研究制定新时代推动软件业高质量发展的政策措施，推动云计算、大数据创新发展，进一步扩大和升级信息消费
"
3,2018-08-16T08:33:10,/news/100011663.html,消费扩容态势平稳发展，优质消费类公司受关注,"近期开始出现公司回购意愿、市场价低于公司高管增持价、员工持股价格的迹象，建议关注其中的优质公司
"
4,2018-08-16T08:22:43,/news/100011651.html,白宫称美国不会取消对土耳其钢铝产品加征的关税,白宫发言人桑德斯表示，美国加征关税的举动是“出于国家安全利益考虑”。即便土耳其释放美籍牧师布伦森，美国也不会取消对土耳其钢铝产品加征的进口关税。
5,2018-08-16T07:25:02,/news/100011642.html,市场风险不断释放，机遇与挑战并存,分析人士认为，当前A股经过一段时间调整，风险充分释放，与国际其他市场相比估值并不高。虽然外部环境面临一些不确定性，但这也是促进我国经济结构调整的动力，机遇和挑战并存，A股对境外投资者具有很大的吸引力。
6,2018-08-15T23:16:34,/news/100011618.html,中国结算明确外籍人员可以参与A股交易的申请条件,中国结算8月15日发布通知称，境内工作的外籍人员自9月15日起可以开户参与A股交易。
7,2018-08-15T22:55:37,/news/100011610.html,腾讯：《怪物猎人》后续开发未过审，目前15款游戏审批中,腾讯管理层称，我们相信游戏通过审批只是一个时间问题。我们目前有15款游戏正在审批中，未来也会发布更多游戏。
8,2018-08-15T22:32:42,/news/100011598.html,7000万降至2500万！明星片酬酝酿封顶，声明会否变废纸,一些一线演员的片酬已从六七千万元降到2500万元左右。
9,2018-08-15T22:30:52,/news/100011597.html,“拆弹”地方隐性债务，中央下发了这个重磅文件,中央出台了隐性债务防范化解这一最高级别文件，将加大地方化解隐性债务风险力度，重塑经济活力，让经济运行更有效率，这其实也是一种积极财政政策。
10,2018-08-15T22:30:33,/news/100011596.html,利润增长提速，平安银行上半年业绩触底反弹,平安年报显示，2018年上半年，该行营业收入、净利润同比分别增长5.9%、6.5%，明显高于2017年同期的-1.27%、2.13%。相比上年全年，相关数据也有明显改善。
11,2018-08-15T22:24:01,/news/100011591.html,证监会：进一步放开符合规定的外国人开立A股证券账户的权限,本次修改内容主要涉及以下两个方面，进一步放开符合规定的外国人开立A股证券账户的权限。
12,2018-08-15T22:20:29,/news/100011590.html,腾讯财报看点：游戏增长乏力市值缩水，放缓投资步伐寻求新引擎,又到了港股“股王”腾讯放榜时，市场的悲观情绪早在财报发布前开始蔓延。
13,2018-08-15T22:07:37,/news/100011578.html,韩正：充分发挥粤港澳综合优势 深化内地与香港澳门合作,韩正表示，建设粤港澳大湾区，是习近平总书记亲自谋划、亲自部署、亲自推动的国家战略，是新时代推动形成全面开放新格局的新举措，也是推动“一国两制”事业发展的新实践。
14,2018-08-15T22:05:52,/news/100011577.html,特朗普滥用“232调查”对土耳其提高关税合法吗？,特朗普再次滥用“232调查”，借其对土耳其提高关税，问题是这样的做法合乎美国法律吗？
15,2018-08-15T21:59:24,/news/100011575.html,业绩不佳又逢外部环境动荡，两地科技股纷纷跌下神坛,两地科技股走低，市场人士认为有外部环境因素也有个股业绩不佳带累大盘的原因。
16,2018-08-15T21:52:42,/news/100011570.html,社论：医疗补短板不让任何群体掉队,要求将数量庞大且有实际需要的农民工等群体纳入，无疑是民生补短板的重要一步。
17,2018-08-15T21:45:50,/news/100011561.html,文在寅倡议“东亚铁路共同体”，推进东亚经济合作,韩国总统文在寅8月15日提议构建“东亚铁路共同体”，涵盖韩国、朝鲜、中国、日本、俄罗斯、蒙古、美国等国。
18,2018-08-15T21:37:56,/news/100011554.html,进击的小程序,小程序正以流量优势培育着搅局者.
19,2018-08-15T21:37:43,/news/100011553.html,小程序挑战H5和网页，要向操作系统进军,目前微信的定位仍是社交软件，一旦变成操作系统或平台，整个微信势必有大的调整。
20,2018-08-15T21:26:06,/news/100011544.html,基金20年丨养老概念基金这些年,有业内人士称，这些年，公募基金的养老特性并未得到有效传递，这些基金的购买者与其他基金无异;从资金性质来看，其资金的目的主要还是获取风险收益，而不是应对养老，这也是这些基金未能获得市场广泛认可并得以发展的重要原因。
21,2018-08-15T21:22:17,/news/100011532.html,世界机器人大会开幕，学界商界共话行业的泡沫与发展,智能机器相关技术将在2020-2025年出现的拐点——包括核心技术突破与应用基础突破。
22,2018-08-15T21:19:10,/news/100011527.html,ofo的新烦恼和共享单车的旧难题丨记者观察,以规模换估值的发展模式，早就为共享单车的结局埋下了伏笔，没有资本庇护，共享单车真难题才刚开始。
23,2018-08-15T21:18:51,/news/100011526.html,今日头条们：一边道歉一边做大丨百味杂陈,市场出现这样的有趣情况，一边是接二连三的各种监管下架处罚，一边是迅速膨胀的短视频用户群。
24,2018-08-15T21:18:33,/news/100011525.html,山东地炼整合：风光时卖油给中石油、中石化，现一半几近亏损,在新旧动能切换的背景之下，山东地方性炼油厂正经历着一场大变局。
25,2018-08-15T21:13:29,/news/100011524.html,卫生健康委、国家药监局：对接种过长生疫苗儿童进行补种,卫生健康委、国家药监局：按照知情、自愿、免费原则对接种过长春长生201605014-02批次效价不合格百白破疫苗儿童进行补种。
26,2018-08-15T21:13:18,/news/100011523.html,万科A：为规避外汇市场风险 将开展外汇衍生品套期保值,8月15日，万科A发布公告称，为规避外汇市场风险，公司有必要就外汇风险敞口进行更充分的套期保值。
27,2018-08-15T21:12:42,/news/100011521.html,在岸人民币汇率跌破6.9，双边汇率波动不存在绝对底线,当点位变化导致银行结售汇发生大幅度的逆差或者顺差时，调控政策出现调整的概率会增大。
28,2018-08-15T21:10:41,/news/100011520.html,邵宇：政策协同性增强 推动稳妥去杠杆,结构性去杠杆的同时，又要稳杠杆，恰恰表明，要把“坏的杠杆”去掉，同时该加的还是要加，这样才是资源的合理配置。
29,2018-08-15T21:10:41,/news/100011519.html,基金20年丨养老目标基金“箭在弦上” 系统改造升级后启动发行,“养老目标产品有投资者适当性的安排和申购赎回的安排，需要渠道进行系统的开发，因此养老目标产品成立发行还是要看渠道的时间。”另一位公募基金养老部人士也称。
30,2018-08-15T21:10:30,/news/100011518.html,去杠杆的根本是深化改革,没有深化改革这一根本性举措的破局，去杠杆可能不仅不会成功，相反货币闸门开启放出的水，也可能成为一潭死水。
31,2018-08-15T20:14:25,/news/100011495.html,混改一年，中国联通今年上半年净利同比增长231.8% | 中报解读 ,"混改后的中国联通借助战略合作伙伴，移动业务快速发展。但从2018年第二季度看，靠不限量套餐快速发展的业务模式或面临瓶颈。
"
32,2018-08-15T19:37:12,/news/100011474.html,平安银行同时聘任三名副行长，三名高管获集体晋升,平安银行公告称，该行董事会审议通过了聘任杨志群、郭世邦、姚贵平为副行长的议案。由此，平安银行三名行长助理，已集体晋升为副行长。
33,2018-08-15T19:28:02,/news/100011469.html,一财研选｜政策推动解决发展痛点，车联网千亿市场即将开启！,"东吴证券认为，在5G、自动驾驶发展契机下，车联网将注入新的生命力，车联网生态联盟逐步完善将开启国内共享汽车、辅助驾驶等新兴产业，千亿市场可期。
"
34,2018-08-15T19:24:27,/news/100011467.html,银行系债转股子公司迎来私募基金牌照，“有钱买买买”缓解融资掣肘,金融机构可以通过发私募产品，拓宽融资来源以及业务模式。
35,2018-08-15T19:16:55,/news/100011463.html,7月份房价变动情况出炉，多地调控加码坚决遏制房价上涨,“人才引进政策使部分二三线城市短期购房人数增加，楼市供应出现阶段性不足，推升了房价上涨预期。
36,2018-08-15T19:15:11,/news/100011460.html,新华社：防范化解金融风险成效初显——解析中国经济的保障之基,当前经济运行稳中有变，面对新形势新挑战，需要金融领域精准应对，处理好防风险与稳增长的关系，为实体经济发展提供有力保障。
37,2018-08-15T19:08:29,/news/100011459.html,金管局一天两度出手干预汇率港股创新低，里拉虽涨恐慌难消,"8月15日上午，因港元汇价触及弱方兑换保证，香港金管局5月以来首次出手捍卫联系汇率，在市场买入21.59亿港元；当日下午，金管局再度买入23.55亿港元， 这也加剧了流动性压力，导致港股承压。
"
38,2018-08-15T18:45:14,/news/100011445.html,8月15日晚间重要半年报公告速读 ,8月15日晚间，沪深两市多家上市公司发布半年报及相关公告，本文是重要公告摘要，供投资者参考。
39,2018-08-15T18:37:33,/news/100011440.html,腾讯二季度净利润179亿元， 上半年手游收入环比降19%,腾讯披露了2018年二季度以及中期业绩，二季度净利润179亿元人民币；上半年实现净利411.57亿元。
40,2018-08-15T18:34:06,/news/100011439.html,干货！8月15日晚间重要公告速读 ,8月15日晚间，沪深两市多家上市公司发布公告，以下是重要公告摘要，供投资者参考。
41,2018-08-15T18:28:42,/news/100011434.html,三聚环保盘中跌停，王亚伟概念股前景几何？,作为典型的王亚伟概念股，三聚环保公布的半年报预告，似乎并没有符合投资者预期，控股股东近日增持了不少，也将参与其“低价”增发，这引发巨大争议。
42,2018-08-15T18:08:03,/news/100011427.html,老年人癌症保障问题突出，我国首个商保肿瘤药品目录发布,“买不到便宜药，用不起对症药”，对于家有癌症病人的千万普通家庭来说，是一种极大的痛。平安健康险于今日发布了国内首个商保肿瘤药品目录，推出的癌症系列医疗险产品首次将投保年龄开放至70周岁。
43,2018-08-15T17:59:46,/news/100011422.html,商务部：预计消费市场进一步扩容升级的态势不会改变,商务部市场运行司负责人指出，7月份我国消费市场延续了平稳发展态势，预计消费市场进一步扩容升级的态势不会改变，后期仍将保持平稳发展。
44,2018-08-15T17:44:53,/news/100011416.html,南京银行或近期公告定增被否原因，目前核心一级资本充足率已改善,"南京银行内部人士和参会分析师对记者透露，“银行高层目前仍不明确增被否的原因，但近期可能会拿到证监会的正式回复，其中可能会说明原因，拿到回复后会第一时间发布公告。”

"
45,2018-08-15T17:41:59,/news/100011414.html,连续三年弃水超百亿千瓦时，四川多举措促本地消纳水电,四川提出以电力体制改革为重点深化要素市场化改革，探索建设若干水电消纳产业示范区，争取在两三年内基本解决弃水问题。
46,2018-08-15T17:41:34,/news/100011413.html,加大二三线城市布局，旭辉上半年销售额同比增40%,融资方面，旭辉上半年先后发债6笔，旭辉上半年加权平均利息成本为5.3%。
47,2018-08-15T17:27:03,/news/100011407.html,致死占比高达85%，慢性病防控形势依然严峻,2012年，慢性病确诊患者2.6亿人，慢性病导致的死亡已经占到我国总死亡的85%，导致的疾病负担已占总疾病负担的70%。
48,2018-08-15T17:15:44,/news/100011398.html,土耳其法院拒绝释放美国牧师布伦森,布伦森自2016年10月以来就一直遭土耳其当局扣押，他面对涉恐与间谍指控，如果被定罪，可能被判坐牢长达35年。
49,2018-08-15T17:14:50,/news/100011395.html,机构今日买入这3股，卖出智云股份2565万元,当天机构净买入前三的股票分别是华东电脑、南华生物、索菱股份，净买入金额分别为2299万元、768万元、390万元。
50,2018-08-15T17:13:03,/news/100011394.html,独家 | 黄晓明澄清“股票操纵案”，但账户收益去向之谜仍未解开,有法律界人士认为，从现有法律来说，证券法律法规可能“存在一个漏洞”，“出借”和“委托”的界定出现重叠。
51,2018-08-15T17:08:19,/news/100011391.html,多地启动基建补短板   发改委：不带来新的产能过剩和债务问题,补短板可扩大有效投资需求，满足消费需求，形成良性循环。
52,2018-08-15T17:05:20,/news/100011387.html,国务院调查组要求继续做好长春长生公司不合格百白破疫苗处置工作,根据线索，国务院调查组在对长春长生公司调查中进一步查明，该公司生产的效价不合格百白破疫苗涉及同一批次的201605014-01和201605014-02两个批号的产品，共计49.98万支。
53,2018-08-15T16:57:03,/news/100011377.html,5G脚步再近！三大应用场景将带来全新生活,5G颠覆当下生活的三大应用场景之一，即增强移动宽带场景，也就是网络速度更快。
54,2018-08-15T16:51:34,/news/100011372.html,山东汽车制造业迎重大重组 “潍柴”“中通”合为一家,国内主要客车生产商之一中通客车股份有限公司发布公告称，公司实际控制人由山东交通工业集团变更为山东重工集团有限公司。
55,2018-08-15T16:45:14,/news/100011370.html,中报眼 | 上海钢联盈利与应收款齐飞：业绩翻倍增长现隐忧,由于此前公司被各大机构投资者高度看好，使得公司股票估值一直以来都处于居高难下状态，静态市盈率超过百倍已经成为常态。
56,2018-08-15T16:41:51,/news/100011368.html,土耳其驻沪总领事安铜：里拉危机将加速土耳其与中国合作,土耳其驻沪总领事安铜认为，在这个日趋多极化的世界中，土耳其力争实现经济伙伴的多元化，中国将在其中扮演一个重要角色。
57,2018-08-15T16:31:16,/news/100011357.html,黄晓明股票账户“被操纵”，明星们都是怎么玩股票的？,娱乐明星炒股，各显神通。要么从原始股东开始潜伏，等待IPO圣诞分享财富；要么押宝重组定增，借机成为上市公司的重要股东······
58,2018-08-15T16:22:24,/news/100011353.html,普京希望近期与朝鲜领导人会面 讨论双边和重要地区问题,俄罗斯总统普京15日表示，希望近期与朝鲜最高领导人金正恩会面讨论双边和重要地区问题。
59,2018-08-15T16:19:25,/news/100011348.html,土耳其猛烈反击：一边同俄伊抱团，一边对美商品加征关税,土耳其在和俄罗斯及伊朗抱团取暖的同时，强硬宣布对美国产品大幅加征关税。
60,2018-08-15T16:00:37,/news/100011332.html,韩国B&D生活健康：进口博览会将成为获得中国消费者信任的“法宝”,千光云表示，这个平台聚集了中国最优秀的客商、以及全球最优秀的进口产品，并受到了来自中国民众的广泛关注，这对于韩国企业，乃至所有外国企业来讲，都是在中国市场建立互信的最佳时机。
61,2018-08-15T15:55:22,/news/100011328.html,纽约联储：特朗普贸易战无法解决美国贸易逆差问题,美国农业研究期刊的一份调查报告显示，特朗普在美国农民中的支持率正在慢慢下降，在2016年的美国大选中，特朗普在农民中的支持率超过70%，而目前已经下降到50%。
62,2018-08-15T15:32:18,/news/100011317.html,中南建设发布2018半年报：营收、净利润实现双增长,报告期内，中南建设实现营业收入153.2亿元，较上年同期增长20.89%；实现归属于上市公司股东净利润9.3亿元， 同比大幅增长180.08%；净利润率由去年同期的3.0%增加到6.7%，提高3.7个百分点，盈利能力明显改善。
63,2018-08-15T15:19:35,/news/100011307.html,沪深股指全线走低，两市逾3000只个股下跌,周三沪深两市股指再度深幅回调，主要指数均跌逾2%，创业板指盘中失守1500点整数关口。个股方面，两市逾3000只个股下跌，相关热点板块全线走低。
64,2018-08-15T15:15:54,/news/100011303.html,市场多重因素导致在岸人民币对美元一度跌破6.9,新兴市场货币不稳定，以及7月份宏观数据不强劲导致市场对人民币情绪总体偏空，加之美元走强，进一步打压了人民币汇率。
65,2018-08-15T15:04:16,/news/100011290.html,中央下发防范化解隐性债务风险文件 隐性债务口径明确,随着不少地方开始传达学习《中共中央国务院关于防范化解地方政府隐性债务风险的意见》，各地将相继化解隐性债务风险。
66,2018-08-15T14:54:26,/news/100011284.html,农业农村部：炭疽疫情可防可控,近期，黑龙江桦南县一种畜场发生一起羊炭疽疫情、内蒙古通辽市科尔沁区胜利村发生一起牛炭疽疫情。农业农村部称，目前，该疫情已得到有效控制。
67,2018-08-15T14:53:46,/news/100011283.html,陆奇单枪匹马进YC,最终，陆奇选择了CMU 计算机学院师兄李开复的路子做起了投资。
68,2018-08-15T14:40:49,/news/100011276.html,加码大基建，绿地15亿控股天津建工,天津建工是绿地控股投资控股贵州建工、江苏省建、西安建工之后，又一个通过外延式做业务规模增量的标的。
69,2018-08-15T14:33:57,/news/100011272.html,上半年环保税近百亿同比增两成，倒逼企业减少排放,今年开征的环保税上半年收入96.8亿元，与去年同期同口径排污费相比增长22.1%，促进企业治污减排。
70,2018-08-15T13:33:34,/news/100011241.html,俄官员说美国制裁土耳其无碍俄土经贸合作,俄外交部长拉夫罗夫称，美国对土耳其实施的制裁非法，违反了国际贸易准则。为克服美方非法设置的这类经贸阻碍，俄正与土耳其和其他国家磋商在双边贸易中使用本国货币支付。
71,2018-08-15T13:03:56,/news/100011231.html,国家发改委：中国经济不是一次外部冲击就能被打垮,国家发改委新闻发言人丛亮今日指出，改革开放以来，中国经济发展曾多次面临严峻的考验，但不仅没有被击倒，而且是在困难当中成长、壮大。
72,2018-08-15T13:02:29,/news/100011229.html,美加征关税是否影响到中国机器人生产？ 发改委回应,丛亮表示，因为真正加征关税是从7月份以后开始，机器人生产增速近期回落跟加征关税的关系还不是很明显。
73,2018-08-15T13:00:57,/news/100011228.html,发改委：中美经贸摩擦对中国经济影响很有限,丛亮强调，总体看，因为中国经济目前特别是1-7月份的数据来看，整个中美经贸摩擦对中国经济的影响还是很有限的。
74,2018-08-15T12:56:26,/news/100011226.html,加拿大拟首度动用“紧急措施”保护其钢铁产业,加拿大联邦政府14日表示，准备采取所谓“紧急保护措施”，限制外国钢材产品进口，以保护其本国钢铁产业。
75,2018-08-15T12:54:18,/news/100011225.html,土耳其宣布将大幅提高美国产品关税，汽车提高120%,8月15日消息，土耳其方面发布公告称，将提高一些自美国进口商品的关税，包括乘用车、酒精、烟草等。
76,2018-08-15T12:48:45,/news/100011223.html,乐视网：公司不直接或间接持有FF任何权益,针对股票上涨波动的情况，乐视网发布公告称，乐视网不直接或间接持有Faraday Future任何权益，且与Faraday Future无股权关系或任何合作关系。
77,2018-08-15T12:08:22,/news/100011207.html,市场又一次靠近2700点关口，基金经理仍坚称“最悲观时刻已过”,股市上半年持续下跌一个重要原因是流动性形势极为紧张，但好的方面是最紧张的时间点可能已经过去了。
78,2018-08-15T11:50:57,/news/100011200.html,钢铁业盈利好转利好产业链，钢银电商上半年营收逾444亿元,钢铁行业盈利的好转正直接带动周边一大批相关产业链条上的公司。
79,2018-08-15T11:46:32,/news/100011198.html,瑞典多地发生燃爆恶性事件，我使馆发安全提醒,当地时间8月14日，在瑞典第二大城市哥德堡及附近城镇，约100辆汽车遭当地年轻人有组织、有准备地纵火破坏。中国驻瑞典大使馆提醒在瑞典中国公民注意加强安全防范。
80,2018-08-15T11:46:20,/news/100011197.html,独家丨兵团六师债即将兑付，资金已划至上清所,就城投债而言，此前2009年的“07宜城投债”和2017年的“14新密财源债”也先后发生过技术性违约。
81,2018-08-15T11:45:50,/news/100011194.html,里拉暴跌利好土耳其旅游：今年预计吸引40万中国游客,携程酒店大数据研究中心数据显示，近两周以“土耳其”为关键字搜索、浏览的用户量环比增长近500%，8月12日以来，土耳其线路的搜索报名人数一夜暴涨150%。
82,2018-08-15T11:36:08,/news/100011188.html,消费股大跌，沪指跌破2750点关口,今日早盘沪深两市股指双双低开。盘中，消费股、周期股等快速下行，沪指跌破2750点支撑位；医药、新能源汽车等概念股相继大跌，创业板指失守1500点。
83,2018-08-15T11:17:38,/news/100011175.html,上海国际文学周讨论旅行的意义，成为奈保尔那样的出色旅行者,8月14日，上海书展开幕前的夜晚，28位来自海内外的学者、作家、诗人齐聚国际文学周主论坛，共话“旅行的意义”。
84,2018-08-15T11:15:54,/news/100011174.html,港股“股王”腾讯即将发布半年报，股价重挫逾3%创11个月来新低,目前来看，市场普遍估计腾讯控股上半年Non-GAAP净利润在351.18亿至388.13亿人民币，较去年上半年数据同比增长14.8%至26.8%。
85,2018-08-15T10:34:45,/news/100011145.html,国办发文深化增值税改革 税率三档并两档将落地,增值税深化改革的下一步是，6%、10%和16%三档税率如何并为两档。
86,2018-08-15T10:19:09,/news/100011123.html,异地就医范围扩大，1.7亿农民工有望受益,长期以来，在户籍地参加新农合的农民工，在就业地难以享受到医疗保险待遇。一旦生病，他们只能返乡看病，大大地增加了就医的经济和时间成本。
87,2018-08-15T10:15:18,/news/100011120.html,时隔3个月金管局再度出手干预港元，港股重挫逾1％,"8月15日，因港元汇价触及弱方兑换保证，香港金管局5月以来首次出手捍卫联系汇率，在市场买入21.59亿港元，这也加剧了流动性压力，导致港股承压。

"
88,2018-08-15T10:04:53,/news/100011104.html,中弘股份跌破1元，沦为“仙股”,周三早盘开盘，中弘股份重挫逾8%，盘中一度触及跌停，股价跌破1元，最低至0.94元，沦为“仙股”。
89,2018-08-15T09:52:20,/news/100011096.html,统计局：7月一二线城市新建商品住宅销售价格环比涨幅回落,国家统计局发布7月份70个大中城市商品住宅销售价格变动情况统计数据。从环比看，4个一线城市新建商品住宅销售价格上涨0.2%，涨幅比上月回落0.4个百分点。
90,2018-08-15T09:18:20,/news/100011076.html,80后猪队友新传：包场8888总统套房炒股，投17亿亏5.5亿有哪些神操作,两个80后，一个富二代一个股神，如何一起操纵股价，最终又双双末路狂奔······
91,2018-08-15T09:17:49,/news/100011075.html,中国7月经济数据解读：政策效果仍有时滞，预计经济缓中趋稳,各家机构指出，7月经济继续走弱，金融和实体经济延续此前的惯性表现在预期之内，其中，基建投资拖累明显。政策仍有时滞，预计经济将缓中趋稳。
92,2018-08-15T08:49:30,/news/100011045.html,海南一号明年下半年择机发射，龙头受益,海南一号卫星整星方案通过专家评审，将按计划进入卫星正样设计、总装和综合测试阶段
93,2018-08-15T08:42:54,/news/100011042.html,通武廊工业合作或立足污染治理，关注清洁取暖,"当前京津冀大气污染治理行动方案中要求加大钢铁、焦化、建材等行业产能淘汰和压减力度，同时加快推进清洁取暖
"
