,CreateDate,url,NewsTitle,NewsNotes
116,2018-08-08T08:35:54,/news/100007922.html,东京奥运会安防引入人脸识别，再引爆追捧热潮,"受益于未来下游应用需求增长、人脸识别产业政策扶持、技术逐渐成熟等因素的有利影响，人脸识别未来持续发展能够得到保障
"
117,2018-08-08T08:35:21,/news/100007921.html,3D NAND研发取得新进展，产业链上企业受益 ,长江存储公开发布了全新3D NAND架构XtackingTM，预计2019年进入量产阶段
118,2018-08-08T08:19:55,/news/100007913.html,人民日报：增强消费对经济发展的基础性作用,消费对我国经济发展的基础性作用不断增强。未来，消费作为保持经济平稳运行“压舱石”的作用将更加凸显。
119,2018-08-08T07:32:42,/news/100007899.html,沪指二次探底接近完成，短期或惯性冲击2800点,机构认为，A股市场周二探底回升，沪指二次回荡 2691 点已接近完成。但未来大盘阶段性底部的确立仍需成交量持续放大，领涨热点持续推进以及实质性利好政策不断出台等三方面因素的共同作用。
120,2018-08-08T00:44:29,/news/100007878.html,针锋相对不买美国账，俄罗斯寻求与伊朗扩大经贸合作,在美国公布对伊朗的新一轮制裁决定之际，俄罗斯选择继续扩大与伊朗的经贸合作，并呼吁更多国家可以加入进来。
121,2018-08-07T23:28:49,/news/100007868.html,股市汇市触底飘红，金融稳预期提振信心,上证指数可望形成“双底”的结构，从政策方面看，从货币到财政，稳定经济增长的政策逐步推出，市场利率下滑，都让最近疲软的股市得到了一定的支持。
122,2018-08-07T23:10:57,/news/100007863.html,检查10分钟收费600元，宠物医疗行业野蛮“掘金”,宠物主人几乎没有讨价还价的权利。
123,2018-08-07T22:28:30,/news/100007853.html,7月外储不降反升，跨境资金保持净流入,外储增加意味着，在人民币贬值压力加大的情况下央行没有大量使用外汇储备去调控汇率。
124,2018-08-07T22:09:09,/news/100007842.html,国家卫健委：部署接种长春长生公司狂犬病疫苗续种补种工作,为推进有关工作落实，国家卫生健康委员会将组织开展跟踪观察、咨询服务和疫苗补种等相关工作的督导检查。
125,2018-08-07T22:08:34,/news/100007841.html,韩国可能解除互联网银行持股限制，阿里腾讯竞争再起,随着韩国可能解除互联网银行持股限制，已在韩国有所布局的中国两大互联网金融巨大——阿里和腾讯或将迎来扩张的新机遇。
126,2018-08-07T22:00:15,/news/100007833.html,皮皮虾上线两个月注册用户70万,从被关停的“内涵段子”到重新定位的“皮皮虾”，从流量中成长起来的今日头条如今也需要更加多元的流量支撑。
127,2018-08-07T21:59:43,/news/100007832.html,社交电商竞争加速 支付宝上线拼团业务,淘宝联合支付宝推出的“拼团”业务近期在支付宝主页已悄然上线。
128,2018-08-07T21:59:21,/news/100007831.html,进击的印尼游戏市场,在印尼，手机游戏堪称打发时间的神器。
129,2018-08-07T21:58:09,/news/100007829.html,起底夏令营产业：爆发式增长，头部企业市场份额不足2%,海外形式研学主要赚的是信息不对称，国内机构像是中介一样把在国内招募的儿童输出到海外的机构。
130,2018-08-07T21:57:40,/news/100007828.html,集中式和分散式，哪个才是长租公寓的未来丨麻辣地产,人们对长租公寓的讨论有多少，对发展集中式还是分散式的长租公寓讨论就有多少。
131,2018-08-07T21:57:12,/news/100007826.html,CEO唐彦文：青春交给了盛大游戏 | 人物,唐彦文为人低调，已经在盛大有了近13年的从业经历，一路从基层走上了CEO的位置，被称为“盛大梦”的代表。
132,2018-08-07T21:56:30,/news/100007825.html,北京现代加快布局新能源，2020年前推出9款新车型,合资车企正面临自主品牌不断侵蚀市场份额的局面，在新能源汽车领域抢夺先机尤为重要。
133,2018-08-07T21:56:17,/news/100007824.html,又一互联网领军企业落子上海，李强应勇会见创始人,李强说，此次小米集团在上海布局的金融科技、物联网和工业设计等，与上海产业和科技发展方向高度契合。
134,2018-08-07T21:56:13,/news/100007823.html,社论：稳预期关键是信心,稳预期的核心是稳定信心，克服悲观，修正预期，需更大魄力的改革措施作为支撑。
135,2018-08-07T21:55:11,/news/100007822.html,大展“四两拨千斤”财技，部分国资两个月连“囤”多壳, 短短一两个月内，同一国资连续出手，将多个上市公司控制权收归囊中。A股市场频繁波动而引发股东流动性危机的卖壳潮中，部分国资已经悄然开始了“囤壳”行动。
136,2018-08-07T21:48:21,/news/100007818.html,刘春泉：电子商务法算法监管条款分析,关于算法推荐的规范难点在于，算法推荐是个性化推荐，客户端看到的是推荐结果，往往不重复，客户端难以对算法进行验证、取证。
137,2018-08-07T21:38:46,/news/100007803.html,蛰伏三年发起要约收购，京基正面迎战*ST康达管理层,即使京基能顺利完成要约收购，取得对*ST康达的控股权，面对代表华超投资利益的公司管理层，京基如何实现真正的控制权？
138,2018-08-07T21:38:31,/news/100007801.html,中型房企发展样本：弘阳内部的四大变革,对于房企而言，有了一定规模，才能进行风险对冲，在城市轮动周期中保证发展的可持续性。
139,2018-08-07T21:34:16,/news/100007797.html,特朗普频频威胁退出WTO？国会欲阻止其臆想,忧虑于美国退出WTO后的巨大风险，美国共和党不会再坐视不管。
140,2018-08-07T21:25:33,/news/100007788.html,十问巴曙松：资管新规系列配套文件落地是动态微调，非全面转向,巴曙松认为，如今市场还不明确的是关于资管新规执行的节奏，以及执行的节奏对市场可能会造成的影响。
141,2018-08-07T21:23:17,/news/100007787.html,李旭红：如何做好积极财政政策中的增值税减税,虽然增值税的增幅随着我国企业的营业收入及利润率的增长上升了，但从结构占比看，增值税占税收总额的比例是下降的。
142,2018-08-07T21:20:36,/news/100007786.html,上海国际能源交易中心提示原油期货风险,上海国际能源交易中心发布公告提示原油期货风险。
143,2018-08-07T20:25:27,/news/100007768.html,无还本续贷能否解小微融资难题？业内建议可从“三农”扶贫试点,考虑到小微企业“无还本续贷”风险，可以先针对精准扶贫与“三农”贷款领域进行创新。“三农”及精准扶贫由于单笔金额小，或可尝试推开。
144,2018-08-07T20:23:00,/news/100007766.html,农业农村部：沈阳沈北新区非洲猪瘟疫情得到控制,截至目前，辽宁省沈阳市沈北新区发生的非洲猪瘟疫情，疫点和疫区内所有生猪的扑杀工作已全部完成，疫情已得到有效控制。
145,2018-08-07T19:47:20,/news/100007745.html,港股大涨重回28000点，恒大21.15%涨幅领跑内房股,8月7日，香港恒生指数迎来近一个月最大单日涨幅，今天指数上涨429.32点，涨幅1.54%，收盘28248.88点，重新攀回28000点大关。
146,2018-08-07T19:43:50,/news/100007743.html,上半年我国市场主体总量超1亿户，大众创业意愿持续高涨,上半年新设市场主体998.3万户，同比增长12.5%，平均每天新设5.52万户。
147,2018-08-07T19:40:16,/news/100007742.html,乐视网：被起诉类案件合计涉案金额人民币6.75亿,乐视网发布公告称，经统计，公司被起诉类案件合计涉案金额人民币6.75亿元。
148,2018-08-07T19:38:04,/news/100007741.html,夏令营中的海外并购融合路：这些外国孩子也成了“中企子弟”,解决文化融合是央企争创具有全球竞争力的世界一流企业工作的重要一环。
149,2018-08-07T19:25:34,/news/100007732.html,一财研选｜IAAS资本开支高歌猛进，公有云产业投资价值显著！,7月31日以来，本栏对基建板块的研报进行了数次选摘，并对重点公司苏交科的公司研究也进行了选摘，为读者提供了有益的参考，今天本栏再次提供国信证券对于基建板块的分析，希望能从另一个角度透视基建板块。
150,2018-08-07T19:24:07,/news/100007730.html,上半年居民消费榜：8省份过万元，城镇化率高花钱就多,10个省份的居民人均消费支出超过了全国平均水平。
151,2018-08-07T19:20:41,/news/100007729.html,私募募资规模大降7成，上半年“募冷投热”趋势明显,“今年基金募资都很难，很多原本做项目为主的合伙人，都出去找钱了，整个市场十分缺钱。”
152,2018-08-07T19:11:24,/news/100007722.html,新华网评养老目标基金：“长钱”或适当熨平A股短期波动,对于这一新型投资工具，投资者该如何看待？养老目标基金怎么投？对A股市场有什么作用？
153,2018-08-07T19:09:08,/news/100007720.html,香港将建第一所中医院 推动粤港澳大湾区中医药产业国际化,香港是国际枢纽，在香港建立中医院，将推动粤港澳大湾区中医药产业的国际化。
154,2018-08-07T18:38:52,/news/100007701.html,微信生态最大服务商微盟拟登陆港交所，腾讯持股3.43%,这些to B公司的目标颇为相似，成为中国的Salesforce。
155,2018-08-07T18:26:55,/news/100007690.html,8月7日晚间重要中报公告速读,8月7日晚间，沪深两市多家上市公司发布中报及相关公告，本文是重要公告摘要，供投资者参考。
156,2018-08-07T18:26:48,/news/100007689.html,干货！8月7日晚间重要公告速读,8月7日晚间，沪深两市多家上市公司发布公告，本文是重要公告摘要，供投资者参考。
157,2018-08-07T17:41:50,/news/100007669.html,天津市原副市长陈质枫因严重违纪受到留党察看二年处分,日前，经中共中央批准，中共中央纪委对天津市原副市长陈质枫严重违纪问题进行了立案审查。
158,2018-08-07T17:24:38,/news/100007657.html,美国内并购交易额同比增30%，海外对美并购明显放缓,和美国国内火爆的并购行为形成鲜明对比的，是海外投资者在美国并购行为的滞缓。
159,2018-08-07T17:18:26,/news/100007651.html,首例证券市场操纵损害赔偿支持诉讼获立案受理,设立于上海的中证中小投资者服务中心宣布，已就恒康医疗集团股份有限公司市场操纵违法违规行为造成的民事损害向成都市中级人民法院提起诉讼，并于2日获正式立案受理。
160,2018-08-07T17:16:40,/news/100007650.html,国务院同意在北京等22个城市设立跨境电子商务综合试验区,《批复》强调，着力在跨境电商企业对企业（B2B）方式相关环节的技术标准、业务流程等方面先行先试，探索跨境电商发展新经验、新做法。
161,2018-08-07T17:08:24,/news/100007646.html,机构今日买入这9股，卖出胜利股份4152万元,当天机构净买入前三的股票分别是易华录、扬农化工、欣锐科技，净买入金额分别为3740万元、3442万元、2234万元。
162,2018-08-07T17:01:01,/news/100007641.html,国务院调查组公布吉林长春长生公司违法违规生产狂犬病疫苗案件进展,调查组强调，长春长生公司案件涉嫌刑事犯罪和涉及监管责任必须依法严肃追究。相关调查及后续有关工作正在抓紧进行中。
163,2018-08-07T16:40:50,/news/100007629.html,多地政府隐性债务超显性债务，正多招齐下化解存量债务,有的地方隐性债务规模甚至是显性债务的3倍多，但债务风险总体可控。
164,2018-08-07T16:36:42,/news/100007626.html,中国7月外汇储备31179.5亿美元 连续第二个月回升,央行公布的最新外汇储备规模数据显示，中国7月外汇储备31179.5亿美元，预期31070亿美元，前值31121.3亿美元。
165,2018-08-07T15:56:18,/news/100007597.html,支持率远超特朗普，美国人希望他成为下届美国总统 ,除了在民主党内有着极高的支持率外，特朗普也曾表示希望拜登参加美国总统竞选。
166,2018-08-07T15:48:25,/news/100007585.html,上交所连发5通知修订5大内容，9问9答看懂收盘交易改了啥,经过调整后，上交所股票交易时间与深交所一致，14点57到15点为收盘集合竞价时间，此时不再接受撤单申请，特此提醒投资者注意。
167,2018-08-07T15:44:19,/news/100007581.html,部分城市楼市逆周期升温 住建部要求地方稳地价房价,整个上半年楼市调控高达192次，累计叠加7月单月接近70次调控。2018年前7个月房地产主要城市调控次数达到260次，房地产调控次数刷新了历史纪录。
168,2018-08-07T15:19:23,/news/100007571.html,银保监会：重点打击非法集资资金发放民间贷款等活动,《通知》要求，各级监管机构要加强市场准入审查，严禁涉黑涉恶人员和组织参股、控股银行保险机构，严禁涉黑涉恶人员担任银行保险机构的董事、监事、高级管理人员。
169,2018-08-07T15:18:35,/news/100007570.html,抵制美对伊朗制裁，欧盟启动“阻断法令”保护欧洲企业,在“阻断法令”下，欧洲企业仍可在欧盟的保护下，继续在伊朗境内从事合法生意。
170,2018-08-07T15:17:23,/news/100007569.html,原油期货主力合约迎首次涨停，报537.2元创历史新高,“有部分国内基本面的因素，但也有资金的因素。”
171,2018-08-07T15:15:43,/news/100007568.html,石油、基建板块大涨，上证50指数涨逾3%,今日沪深股指早盘高开后震荡下行。盘中，石油股、基建股软件股等纷纷大涨，两市股指全线展开“V”形反转并强势上攻。
172,2018-08-07T15:02:16,/news/100007552.html,山西混改再提速，四大省属煤企将组建四大行业集团,下半年，山西四大省属煤企晋煤集团、潞安集团、阳煤集团、焦煤集团将分别牵头重组燃气、化工、煤机装备、民爆四大行业集团，并设置了时间节点。
173,2018-08-07T14:52:20,/news/100007547.html,住建部召开部分城市座谈会 对楼市调控不力的城市坚决问责,完善对地方房地产调控工作的评价考核机制。要严格督查，对工作不力、市场波动大、未能实现调控目标的地方坚决问责。
174,2018-08-07T14:46:21,/news/100007542.html,市场观察|资源禀赋深厚难敌行业周期，云铝股份二季度艰难扭亏,综合多位行业分析师的报告来看，国内唯一的水电铝企业以及较为丰富的铝土矿储备是他们较为关注云铝股份的主要原因。
175,2018-08-07T14:38:21,/news/100007538.html,住建部召开部分城市房地产工作座谈会：楼市调控不力 坚决问责,住房和城乡建设部将建立房地产市场监测体系，完善对地方房地产调控工作的评价考核机制。要严格督查，对工作不力、市场波动大、未能实现调控目标的地方坚决问责。
176,2018-08-07T14:26:54,/news/100007529.html,监管强化，PPP政府中长期支出被地方定为隐性债务,随着地方将PPP中长期支出明确为隐性债务，在遏制隐形债务增长背景下，政府付费类PPP项目将明显压缩，其他类项目也受到影响。
177,2018-08-07T14:03:12,/news/100007525.html,马骏谈疏通货币政策传导机制：应考虑进一步完善定向降准等,应考虑进一步完善定向降准和MPA的措施（如在定向降准的支持内容中加入绿色环保），加大对这些企业的再贷款、担保和贴息的力度，支持中小企业集合债的发行，适度扩大贷款抵押品范围，进一步明确资管新规的过渡期安排。
178,2018-08-07T13:58:58,/news/100007520.html,200万销量是道坎？吉利如何避免规模陷阱,汽车行业有“规模陷阱”一说。车企在进入比如50万、100万、200万乃至1000万这一特定规模之时，便会出现盘整和徘徊期。
179,2018-08-07T13:53:04,/news/100007517.html,消息称戴姆勒与北汽新能源成立合资公司，生产Smart电动车,针对合资事宜，奔驰（中国）方面暂时并未给出回复，北汽新能源则回复第一财经称并不知情。
180,2018-08-07T13:52:25,/news/100007516.html,若谷歌重返中国大陆 李彦宏称有信心再赢一次,如果谷歌决定回到中国，百度非常有信心再PK一次，再赢一次。
181,2018-08-07T13:27:59,/news/100007505.html,伊朗央行：将实施一系列放松外汇管制措施,伊通社援引伊朗央行行长赫马蒂的话说，央行将实行有管理的浮动汇率制度，但浮动汇率并不意味着没有监管，央行不会直接干预汇率，但会通过货币手段进行调控。赫马蒂表示，新措施显现伊朗应对美国制裁的自信。
182,2018-08-07T13:02:15,/news/100007497.html,高压监管下还剩多少银行“影子”,今年以来实际社融增速放缓速度要远远快于央行统计数据。作为社会融资的组成部分，影子银行规模的下降将导致整体社会融资规模增速放缓。
183,2018-08-07T12:48:31,/news/100007496.html,深度|百花村与张孝清之战：是引狼入室，还是卸磨杀驴？,作为上市公司总经理的张孝清，已经被上市公司抛弃。
184,2018-08-07T12:34:32,/news/100007492.html,伊朗总统：美国要谈判应拿出诚意,鲁哈尼说，伊朗人民团结一致，将挫败美国的制裁措施。美国无论过去、现在，还是将来，都无法通过这种方式让伊朗人民屈服。
185,2018-08-07T12:12:10,/news/100007481.html,专访巴曙松：资管新规微调十分必要，金融基础设施建设需加快,巴曙松认为，在不违反现有大方向的基础上，就实施的进度、力度、范围进行适应性的微调也是必要的。
186,2018-08-07T11:48:01,/news/100007471.html,常纪文：加强环保中介技术服务机构信用管理丨诚信建设万里行,预计在未来的两到三年内，环境保护中介技术服务行业在竞争中因为服务质量和服务能力两个方面的挑战，将面临大洗牌。
187,2018-08-07T11:46:20,/news/100007470.html,华铭智能遭发函关注，实控人披露增持计划后仅增持2万股,请核实说明张亮先生是否违反了诚实守信原则，增持计划是否存在虚假或误导性陈述，是否存在炒作股价的情形，是否损害中小投资者利益。
188,2018-08-07T11:44:43,/news/100007469.html,中字头概念强势领涨，A股迎来“深V”反转,周二沪深两市股指震荡回升，中字头概念盘中强势领涨，带动上证综指反弹，指数涨逾1%。深圳市场同样表现强势，创业板指止跌回升涨近2%。
189,2018-08-07T11:41:33,/news/100007468.html,上海改革开放40周年｜友邦中国：“出生”在上海的中国首家外资寿险站上新起点,友邦中国区CEO张晓宇在日前接受第一财经专访时表示，友邦一直期盼能够在中国大陆进一步扩展其经营地区，期待进一步开放实施细则的公布，并且也在积极准备。
190,2018-08-07T11:31:56,/news/100007466.html,伍戈：我国经常账户不会持续逆差,当前海外经济景气度仍处高位震荡，叠加前期人民币贬值的滞后作用，下半年我国出口基本面并不悲观。
191,2018-08-07T10:23:08,/news/100007432.html,中国恒大涨逾10%，上半年净利超520亿,恒大去年上半年净利润为231亿，核心业务利润为273亿，据此估算其今年上半年税后净利润超520亿，核心业务利润超546亿。
192,2018-08-07T08:46:39,/news/100007390.html,发改委调研基建投融资，关注中西部水泥龙头,"发改委赴河南、湖北、江西开展基础设施投融资实地调研，关注中西部基础设施建设
"
193,2018-08-07T08:37:18,/news/100007377.html,二季度全球芯片销售大涨，关注龙头企业,二季度全球芯片销售额1179亿美元，同比大涨20%
194,2018-08-07T08:36:36,/news/100007376.html,首批养老目标基金获批，或以长期投资引领市场,"对当下的A股市场来说，算不上直接利好，但不可否认，养老金是最好的长期投资品种，如果想提高养老金的投资回报率，最大的诀窍就是“做股东”
"
195,2018-08-07T08:21:01,/news/100007371.html,应对美对伊朗制裁冲击　欧盟将实施最新反制裁条例,欧盟委员会6日宣布，在美国重启对伊朗非能源领域制裁之际，欧盟最新反制裁条例将于7日生效，以保护与伊朗开展合法业务的欧洲公司免受美国域外制裁影响。
196,2018-08-07T07:44:05,/news/100007362.html,场内资金套现欲望较强，后市仍面临较大不确定性,"机构认为，近期投资者观望情绪浓重，场内资金离场欲望依然较强，后市股指运行仍面临较大不确定性。预计沪指或继续考验2691点支撑，此时不建议盲目进场抄底。
"
197,2018-08-07T00:23:54,/news/100007341.html,土耳其央行入场救市无效，里拉加速跳水再创历史新低,土耳其央行宣布调整外汇准备金政策以扩大市场外汇供应，市场反应冷淡，里拉汇率小幅反弹后再次加速跳水刷新历史低点。
198,2018-08-06T19:31:05,/news/100007186.html,农夫山泉董秘周力否认IPO，称无上市计划，只是接受例行辅导,据悉，这并非农夫山泉首次否认上市事宜，但多名金融业内人士向第一财经记者表示，上述辅导报告来源是证监局网站，基本可以确认公司在走IPO流程。
199,2018-08-07T10:52:00,/news/100007447.html,离世界百强更近了！恒大发最强盈喜净利超 520亿,今年上半年，恒大实现销售 3041.8亿，同比大增 24.6%，多家投行预计恒大全年销售将突破6000亿，强劲的销售为恒大利润持续高增长提供有力保证，而盈利也没有让投资者失望。
200,2018-08-06T23:34:18,/news/100007338.html,资金面持续宽松，市场利率下行空间有限,目前市场上流动性充裕，资金压力较小，冲击因素相对可控。资金利率水平将维持在低位震荡，但无进一步大幅下行空间。
201,2018-08-06T23:27:24,/news/100007334.html,部委地方落实下半年经济工作，稳预期防风险是关键词,第一财经记者发现，稳预期和防范风险被多次提及，而且成为部署下半年宏观经济政策的着力点。
202,2018-08-06T23:07:21,/news/100007328.html,三天亏10多亿！台积电中毒“想哭”，连累苹果发新品,台积电是苹果新一代A12处理器的独家供货商，而苹果公司今秋的重磅新品发布会在即，能否如期出货也是一大考验。
203,2018-08-06T22:59:32,/news/100007325.html,上交所：风险警示股票盘中换手率达30%的可临时停牌,一、《管理办法》第八条第二款修改为：“风险警示股票盘中换手率达到或超过30%的，属于异常波动，本所可以根据市场需要，对其实施盘中临时停牌，停牌时间持续至当日14:57。”
204,2018-08-06T22:56:00,/news/100007322.html,上交所：新股上市首日盘中成交价涨跌超过20%的不再实施临停,新股上市首日连续竞价阶段，盘中成交价格较当日开盘价首次上涨或下跌超过10%的，本所对其实施盘中临时停牌；盘中成交价格较当日开盘价上涨或下跌超过20%的，本所不再对其实施盘中临时停牌。
205,2018-08-06T22:55:50,/news/100007321.html,美国宣布将于7日起重启对伊朗非能源领域制裁,美国政府高级官员宣布，美国将于７日起重启对伊朗金融、金属、矿产、汽车等一系列非能源领域制裁。
206,2018-08-06T22:38:07,/news/100007318.html,上交所调整收盘交易机制：最后三分钟集合竞价 不可撤单,收盘交易机制及相关调整将自2018年8月20日起实施。
207,2018-08-06T22:19:35,/news/100007303.html,为何成都被国际权威智库排名全球大都市前三？,在中国大城市大量进军世界城市的过程中，成都成为表现最为耀眼的城市。
208,2018-08-06T22:19:32,/news/100007302.html,库克： 万亿市值公司缔造者 | 人物,库克总是时刻让自己保持危机感。他曾把苹果的管理与奶制品行业做对比：“如果过了新鲜期，那么你的产品就有问题了。”
209,2018-08-06T22:14:30,/news/100007295.html,全球车企冠亚易位，雷诺-日产-三菱拼团胜大众,雷诺-日产-三菱联盟公布了其2018年上半年销量数据，联盟以553.9万辆的成绩坐上全球车企销量冠军宝座。
210,2018-08-06T22:14:01,/news/100007293.html,东风、一汽、长安抱团， 上汽以一敌三,在汽车产业朝电动化、智能化、互联化和共享化转型过程中，一汽、东风和长安越走越近。
211,2018-08-06T22:13:12,/news/100007292.html,腾讯、网易夹缝中的游戏第二梯队,如今国内的游戏产业已经进入非常成熟的时刻，红海市场流量不够，竞争非常惨烈。
212,2018-08-06T22:12:10,/news/100007291.html,电商平台迎战后流量时代丨滴水成海,"过去数年，借助6·18、双11等促销活动，阿里、京东等电商平台的GMV(GrossMerchandiseVolume,网站成交金额)高速飙升，而今这种状况正悄然发生着改变。"
213,2018-08-06T22:04:33,/news/100007280.html,境外空头头寸克制，资本项下流入将成人民币汇率关键,对冲基金看空人民币的偏好比起2015、2016年时克制，有些在6.75左右点位已获利了结。未来资本项下的资金流入可能成为人民币汇率的关键变量。
